{
  "files": {
    ".clang-format": "889de0c77a6ce473d981be32315a12752c0d7e4f59e40a9fc2e4b7a5fb410e02",
    ".clang-tidy": "0d06a921ef34aed38b697ede5398e72e7e7c5c7961da3acac3e213cc0efb85b8",
    ".clusterfuzzlite/Dockerfile": "a0499bd61505cfd7097b2cc542d5e6de900b76647afd0e3609e8ddb7df42c007",
    ".clusterfuzzlite/build.sh": "e48b13a1d4423b6a3240e2742a14ff7e96319ead3f8d000f4092a4cd20f8707e",
    ".clusterfuzzlite/project.yaml": "b512b8282a40607b87ffc76112a0cfc1ddfbfd07edd4b413e2455dda26d91b9a",
    ".dockerignore": "04a88380bf007069ea7b68a2e0eaf44c5ee93cccc7705bc0891c05fb0a172c5b",
    ".editorconfig": "620abfdd4af59f847b62f469c8c158439a3776fc52268fb03e438b01c2343178",
    ".githooks/commit-msg": "217cdcdf102c10c3218e964f2fa5f00637161b103a9d2992adeabfa4f36cf2f4",
    ".githooks/personal_info_check.py": "cdaa4cb1cd4f869afeceb7d996c2dfdc7de28ac18966e021a0bc9881c3860815",
    ".githooks/pre-commit": "5b79e4e0ebaf2c426fcc23fe15a0ccd31d5c6586e127cbb56bf517875caa549e",
    ".githooks/pre-merge-commit": "5b79e4e0ebaf2c426fcc23fe15a0ccd31d5c6586e127cbb56bf517875caa549e",
    ".githooks/pre-push": "f8df123f218d4efddde32c5366757aa3b07b617d501f461a696b47247cbb44e3",
    ".githooks/tests/regression.sh": "e8788c0e2e92e4313add4ba61231d2e3fcdce054efc78592991a78b88b30b53d",
    ".github/workflows/example.yml": "5a688473151ab270051f864d3d506e38675324d39ffc3e6c6bd3ba80a48d0628",
    ".github/workflows/privacy.yml": "f9538343709c829e25e7919c7e5d88161b53a9139722adeb8affa2cb10a3114e",
    ".github/workflows/safety.yml": "f5b554a94ded9acd0944e6f6795b28e7434879199b3c12b13154a26195c5044f",
    ".gitignore": "bb8fd490576505118e3e9833b8a945594588f677b4910ec756fb9231783c0f43",
    "AGENTS.md": "2960510c705bed93bd12a3cc570ebc9ff69e9f29a62952ba8035c87ec516a8fe",
    "CMakeLists.txt": "8c3de36e71aa1791b7c778d4023604271583f908b31eff96f59af9f64217eb50",
    "CMakePresets.json": "741c4a7cc071486238ecacb6292f38a704840f67170b43af834a91891b908727",
    "LICENSE": "610e32ab933b5a258a190058a7314f2bfb5d2f6c62cb1cd0451c2eef771490ca",
    "Makefile": "a20445623880a8a4dad26e00e167f24adff54bed8cbc9ef812151e7b0879636a",
    "README.md": "4af77b882e7aea95b2ebeae013b30e44034a87b364ed75bd27493fc061671852",
    "SOURCE-OFFER.md": "7a0e20ed08ed93d557e7a0d9e7b5769cf9f453fc86ea626afe6442073d8dcff7",
    "benchmarks/performance/cases/bench-control-spin.json": "f47a31dd259c981f6f35b8b686b05c2e6338f7b4e87a9fdf35fc341c3d69be8e",
    "benchmarks/performance/cases/bench-control-touch.json": "3cedc00d0269942b61b71f4309fad0ce9896291d50b03e1e95567f91ea5cc119",
    "benchmarks/performance/cases/bench-control-wait.json": "6ed1dd050cfd360ceadc1cac4c102f2deb4c171cdfa11a0c817687d4ef7540b0",
    "benchmarks/performance/cases/record-scan.json": "b53dc0087de684236b9f16692a805d9a572a9e7ed8a49ab0ca1faa2f827aa737",
    "benchmarks/performance/python/benchlab/__init__.py": "0088b21f4bc888d5a7df931b12d082089de046742bbbf3ea5d414793a44f477e",
    "benchmarks/performance/python/benchlab/agreement.py": "ddc63f1297ab4f028736621c2dfa1c8a70dddb3c7b9e2f11ba3f1336f43a81f1",
    "benchmarks/performance/python/benchlab/capacity.py": "5f26f5771c5afc1418b261cf8d81352d300b644a0b00e5113a5924f181f9354c",
    "benchmarks/performance/python/benchlab/capacity_trial.py": "5843341cbf667a93226f5c836455d834a1f431379323038f907b940c25a4a5a1",
    "benchmarks/performance/python/benchlab/controlcase.py": "47855e5d772966aae9c75d59284ea92b8d3ff4d561eabc1e933ea05bcef363f9",
    "benchmarks/performance/python/benchlab/controls.py": "d62dbfbce8ce8dac599fa02cf6df4775ae69ed3bceee54d45a069043acc842d3",
    "benchmarks/performance/python/benchlab/coverage.py": "28ba8201bcf2161dddef3a424378c47f159d307acdbb7ba22053548558473018",
    "benchmarks/performance/python/benchlab/kernel_trial.py": "fe5e2aa4b0e6502208c32e9cb117dc3ea8c9577e1388d011c2641e74403ff1fd",
    "benchmarks/performance/python/benchlab/markers.py": "df85c770f68c56b9ace1fde6a6951dfbd3d4a2ef84a2f6e20479ab33c96bb61b",
    "benchmarks/performance/python/benchlab/native_inproc.py": "4cc5ba885cdc78104bea9addeee8804aede2e2c1ff17e5d826ccc673d89cc8f0",
    "benchmarks/performance/python/benchlab/native_kernel.py": "0cba3851e866c5a45d898b098a64965035522a574534bda03b9e4647150c01e3",
    "benchmarks/performance/python/benchlab/native_shm.py": "50f100c38e2d10c12e1a77fc5928df468668c8e7126fdfa20a974db169bf2d1b",
    "benchmarks/performance/python/benchlab/native_worker.py": "52867826706c747d7cb14460c3921eb1298adec9d384ceaa41209a792625c50a",
    "benchmarks/performance/python/benchlab/pools.py": "3a4d6b95d3df64b2d93e0542cf3b4185382bf1242889b70bc660e449c91fccc1",
    "benchmarks/performance/python/benchlab/profiling.py": "0d42614a8e4fac9391f9a07adc1d585a22a1150abde3bbc90331b02330253e1d",
    "benchmarks/performance/python/benchlab/recordscan.py": "8918fb4d493f384b8e31ebee85bf63b7bdf4b8fc1bcf057e4408fdc33395c91f",
    "benchmarks/performance/python/benchlab/trial.py": "7d74b3e178ace272f579d30faefb4b587f127760be53b795f267cb80331a9819",
    "benchmarks/performance/python/benchlab/workload.py": "7a301024de3b61dc3849d45618ecfeaf1dd5fc977e406a624e5fbabed851bc79",
    "benchmarks/performance/python/tests/__init__.py": "e3b0c44298fc1c149afbf4c8996fb92427ae41e4649b934ca495991b7852b855",
    "benchmarks/performance/python/tests/stub_worker.py": "5d22dd7b6a132eb159816ddea4c145749dabbeff8090ad166a644b29194d5d31",
    "benchmarks/performance/python/tests/test_agreement.py": "fd243880a2506fdc69fd11ebaf2f9871b2c1c704de859bad97d3fc1531cb7527",
    "benchmarks/performance/python/tests/test_call_deadline.py": "7c10c020699de5a6e2e306de4e1cb01e074e5fa9011874f2a106b6937c5aeea2",
    "benchmarks/performance/python/tests/test_capacity.py": "312725175c239e251655983ae5f44fb906752a2aba37a5610a024787bc3c4968",
    "benchmarks/performance/python/tests/test_construction.py": "77454d917290096aa8945fe57fdf22bcd129dea62b261d40cd721bde733c8236",
    "benchmarks/performance/python/tests/test_coverage.py": "e88add1cd09646af48bde919dc093f2eab21746e36b55e2bd709efd7f6d4caa8",
    "benchmarks/performance/python/tests/test_decide.py": "84608a22d06dc94d3998e893580babf5f58b09c99e11d26c54f515419af28edd",
    "benchmarks/performance/python/tests/test_decide_records.py": "bcbbddd03b3f57b3224d876b6b30d6bcb3458a16db7e49f0437a30b7dbed62bd",
    "benchmarks/performance/python/tests/test_marked_run.py": "7f686f496c254ebfd4e328b2e68bddc55a35bff429a98b1ee7dabde81d1c701f",
    "benchmarks/performance/python/tests/test_markers.py": "93ee0cf10d66a925422a7cca5e7109f589fd8b385372b8c8bb58121660c7ca57",
    "benchmarks/performance/python/tests/test_native_inproc.py": "0cb861b3d1d48d74b4e383bb0e40e3e1c8a888f2e194a12ce9e1e2e024024c85",
    "benchmarks/performance/python/tests/test_native_kernel.py": "fb3c3684ac79b9bb64f2143928b679cec964b25bca1d915ac10d432cc6c8cc58",
    "benchmarks/performance/python/tests/test_native_shm.py": "44af356c7f2306d84d0b25b771b89bbbe2dfb09a4f877e91ff0ed5d65ee73598",
    "benchmarks/performance/python/tests/test_native_worker.py": "16e8d0d87b8a74213162d3ed832eb0374897493d8c2bdc9781c04170306e2ca6",
    "benchmarks/performance/python/tests/test_panel_trial.py": "679cfd7212877b80d05d5895a8d1d21419c16c5a33973c9796767bf8f10f2746",
    "benchmarks/performance/python/tests/test_pools.py": "be7fcf17c0662a1ae53b586546671cc0f09f55dbaf2d9da3722cae1363535c71",
    "benchmarks/performance/python/tests/test_profiling.py": "c0669582012af97e69b39d3fbd5cdefe11e08fc322330a0829eccbca1b859636",
    "benchmarks/performance/python/tests/test_qualification_truth_table.py": "95c49c6cdfadb6d2e1da44eeb4f5a9eb2469bbbfd28792b1c90c94816105b743",
    "benchmarks/performance/python/tests/test_trial.py": "e391b1218c2cc481eea11d01f9811c2121145f7e892fee4a156df01555ff26ee",
    "benchmarks/performance/python/tests/test_wheel_set.py": "c86b29fa68885de83031ac550daaf05f564688d265a15495292b929fb0c84388",
    "benchmarks/performance/python/tests/test_workload.py": "5da1d4ba454d97a831f9e782a5f103f0f1978d53d4115f03acff2b9140bdf345",
    "ci/README.md": "3349b58afb299baa61123012515ada87ba6871076dfc80acb5315ffaedfd1880",
    "ci/changed-examples": "f8300eb8979defac80dbe3a7eb6190865c277b917c17da8c22c3fb82c1c12eae",
    "ci/clusterfuzzlite-workflow.yml.example": "b8ffd1066e26156a38e5da84b2ba876a68201eaacd81980385408dce8e205257",
    "ci/controller-requirements.txt": "1b3f1bb7e369b46de87b394ed9896a6cfa05f267ccbecd66305a2aef94e71487",
    "ci/image-bundle.json": "949b19ef6bd280079025e88ed6934527bb23ae75e78bbb9f67c49cd9a7ea711f",
    "ci/images": "5bc5ba40b91d5671a9d8ddf34162d7388c199ee244b5d83e7e648f0223afd250",
    "ci/project-ci.yml": "258becce4c7930a2f365974274c2ccafaba2a249c9452f0b58955f7b13854458",
    "ci/run": "773acd8d41d0e3e3d3897041a8dbb21430cff76a472e301df76c38c25a9d7268",
    "ci/runner-request": "ca5ceeba3bcc9290d046e285b8080754433504a861317f3b46854e8f3db4c1c7",
    "cmake/Developer.cmake": "e3e839dc9c220e2fce982e091b2723b6490dd99249cad0f1ed8eb6d676ecd34e",
    "cmake/Foundation.cmake": "2bc239f413a577d81d2f15ec9d7f756f25c9e9373785488eed170d35081236cd",
    "cmake/FoundationLibraries.cmake": "d65fcf0af83f3b372152b9f5989d309810239a3555472c2ceb811e61715da1ec",
    "cmake/Project.cmake": "0fdd1a4f6522769b7940e41139e8063c1f280cef2b54a719cbba3f8186a14a0d",
    "cmake/Safety.cmake": "439a194fce8017b1a2cf49c390e317ea0c97f4dbed495823f17bdbe3aaac1afd",
    "cmake/empty.c": "3119dea16f55822ad27182cd705cb8ee193317f465d77b2a8f8d0cd1ad70d821",
    "cmake/prelude.cmake": "4ad068623f3c69718930eabee63fef6d6d153a6d340bef2a0ad58e4add91d99b",
    "container/Dockerfile": "76f527e5c23fb1955a6bedaa3acaf80bd736e4c0bacee0b1e9b1a4969c2c7b86",
    "container/README.md": "f8e41941bebcde4e377096fe71406570c577745e89029d098e2670f370045db4",
    "container/bench-coordinator.py": "ba140079de7e3979d69235fa61500b0631f4ff7fc91e8d2b8596e815cef92f4e",
    "container/bench_capacity_job.py": "ef24d4e882a32bb6385c27b68dc45ed833893460cc7fc1e62c634c0bb679aab8",
    "container/bench_native_job.py": "5ac087fcdac69124b57f2100b1d57510ad5c6b0ccca7d798afb4803c810984b4",